{
  "gate_id": "idea_gate_001",
  "gate_type": "idea_selection",
  "timestamp_utc": "YYYY-MM-DDTHH:MM:SSZ",
  "research_task_id": "task_id_here",
  "options": [
    {
      "option_id": "option_a",
      "summary": "Concise option summary.",
      "score": null,
      "evidence": [],
      "risks": []
    }
  ],
  "human_decision": "option_a",
  "rationale": "Why the human selected, rejected, or rewrote this option.",
  "affected_artifacts": [],
  "downstream_budget": {},
  "attention_cost": {
    "human_actor": null,
    "interaction_mode": null,
    "prompted_at_utc": null,
    "decision_at_utc": null,
    "active_review_minutes": null,
    "wall_clock_latency_minutes": null,
    "options_reviewed": 1,
    "artifacts_reviewed_count": 0,
    "decision_count": 1,
    "notes": "Fill active_review_minutes and latency for every prospective matched-budget run."
  },
  "follow_up_checks": []
}
