{
  "gate_id": "prospective_matched_fml_causality_20260602_000001_frontier_gate_001",
  "gate_type": "frontier_steering",
  "timestamp_utc": "2026-06-01T23:33:36Z",
  "research_task_id": "prospective_matched_fml_causality_20260602_000001",
  "options": [
    {
      "option_id": "step_0001",
      "summary": "Continue branch draft_a67cb21b3b97 after draft",
      "score": 0.627836868090553,
      "evidence": [
        "validation_mae=0.627837",
        "lower_is_better"
      ],
      "risks": [
        "Small FML prospective package; one task and one seed."
      ]
    },
    {
      "option_id": "step_0002",
      "summary": "Continue branch draft_4bcbaa9c1999 after draft",
      "score": 0.627836868090553,
      "evidence": [
        "validation_mae=0.627837",
        "lower_is_better"
      ],
      "risks": [
        "Small FML prospective package; one task and one seed."
      ]
    }
  ],
  "human_decision": "step_0001",
  "rationale": "Select the lower-validation-MAE Causality_causalml branch for this prospective FML matched package while recording that one small task cannot establish general co-pilot superiority.",
  "affected_artifacts": [
    "docs/co_pilot_ai_scientist_v3/experiments/prospective_matched_fml_causality_20260602_000001/co_pilot_branch_summary.json"
  ],
  "downstream_budget": {
    "selected_validation_mae": 0.627836868090553,
    "same_task_as_autonomous": true,
    "fml_max_steps": 2
  },
  "attention_cost": {
    "human_actor": "codex_operator_for_author",
    "interaction_mode": "async_review",
    "prompted_at_utc": "2026-06-01T23:30:36Z",
    "decision_at_utc": "2026-06-01T23:33:36Z",
    "active_review_minutes": 3.0,
    "wall_clock_latency_minutes": 3.0,
    "options_reviewed": 2,
    "artifacts_reviewed_count": 1,
    "decision_count": 1,
    "notes": "Prospective operator-recorded FML package gate; not an independent human-subject measurement."
  },
  "taste_insight": {
    "rubric_version": "2026-06-02",
    "scores": {
      "problem_depth": 4,
      "novelty_potential": 3,
      "mechanistic_value": 4,
      "failure_informativeness": 4,
      "benchmark_taste": 4,
      "claim_significance": 3,
      "risk_asymmetry": 3
    },
    "taste_insight_score": 3.57,
    "qualitative_rationale": "The branch choice is scientifically modest but claim-relevant: Causality_causalml directly tests whether frontier steering can be inserted into an AI Scientist-v2 benchmark trajectory.",
    "non_metric_factors": [
      "ai-scientist-v2-trajectory-relevance",
      "negative-results-still-informative"
    ]
  },
  "follow_up_checks": [
    "Compare against the matched autonomous FML run.",
    "Do not generalize from one Causality_causalml run."
  ]
}
